shot_number,start_time_seconds,end_time_seconds,start_frame,end_frame,duration_seconds,metadata_ShotDescription,metadata_GenreCues,metadata_SubgenreCues,metadata_AdjectiveTheme,metadata_Mood,metadata_SettingContext,metadata_ContentDescriptors,metadata_LocationHints_Regional,metadata_LocationHints_International,metadata_SearchKeywords
59,196.6,201.6,5898,6048,5.0,"A young woman is sitting at a wooden table with her head resting on her arms, looking contemplative. She is wearing a dark top and has long brown hair. The room is warmly lit with sunlight streaming in through a window, and there is a wooden box on the table. The genre cues are 'drama', 'romance', and 'emotional', with a prominence of 0.5 in the shot. The subgenre cues are 'romantic drama' and 'emotional drama', with a prominence of 0.3. The mood is 'sad', 'melancholic', and 'reflective', with a prominence of 0.2. The setting context is 'home', 'family', and 'personal', with a prominence of 0.1. The content descriptors are 'loneliness', 'isolation', and 'heartbreak', with a prominence of 0.1. The location hints are 'home', 'family', and 'personal', with a prominence of 0.1. The search keywords are 'heartbreak', 'loneliness', and 'sadness', with a prominence of 0.1.",[],[],[],[],[],[],[],[],[]
60,201.6,203.6,6048,6108,2.0,A serene morning scene in a park with a winding path leading through the trees.,"[{""genre_hint"": ""Nature"", ""prominence_in_shot"": ""High""}]","[{""subgenre_hint"": ""Forest"", ""prominence_in_shot"": ""High""}]","""Peaceful""","""Serene""","""Morning""","""Sunrise""","""Local park""","""Worldwide park""","""Morning sunrise, park, path, trees, sun"""
61,203.6,207.7,6108,6231,4.099999999999994,"A young woman with long dark hair is sitting at a wooden table in front of a window. The window has a view of a sunset with the sun setting behind a cityscape. The woman appears to be in a contemplative mood, with her eyes closed and her head slightly bowed. The lighting in the room is warm and soft, with the sunlight streaming in through the window.","[{""genre_hint"": ""drama"", ""prominence_in_shot"": ""high""}]","[{""subgenre_hint"": ""romance"", ""prominence_in_shot"": ""high""}]","""melancholic""","""reflective""","""indoors""","""personal""","""urban""","""global""","""sunset, cityscape, contemplation, reflection"""
62,207.7,210.7,6231,6321,3.0,,[],[],[],[],[],[],[],[],[]
63,210.7,215.5,6321,6465,4.800000000000011,"A young woman standing on a porch at sunset, holding a piece of paper.","[{""genre_hint"": ""Family"", ""prominence_in_shot"": 0.5}]","[{""subgenre_hint"": ""Family"", ""prominence_in_shot"": 0.5}]","""family""","""sadness""","""family""","""family""","""family""","""family""","""family"""
64,215.5,217.5,6465,6525,2.0,A serene morning scene in a park with a winding path leading through the trees.,"[{""genre_hint"": ""Nature"", ""prominence_in_shot"": ""1""}]","[{""subgenre_hint"": ""Forest"", ""prominence_in_shot"": ""1""}]","""Peaceful""","""Serene""","""Morning""","""Sunrise, trees, path, grass, fog""","""Local park""","""International park""","""sunrise, park, path, grass, fog"""
65,217.5,220.46666666666667,6525,6614,2.9666666666666686,"A young woman standing on a porch at sunset, holding a piece of paper.","[{""genre_hint"": ""Romance"", ""prominence_in_shot"": 0.5}]","[{""subgenre_hint"": ""Family"", ""prominence_in_shot"": 0.2}]","""melancholic""","""sad""","""home""","""personal letter""","""home""","""home""","""love letter"""
66,220.46666666666667,222.6,6614,6678,2.1333333333333258,"A serene park scene at sunrise, with a wooden bench positioned on a winding path.","[{""genre_hint"": ""Nature"", ""prominence_in_shot"": ""1""}]","[{""subgenre_hint"": ""Fantasy"", ""prominence_in_shot"": ""0.5""}]","""Peaceful""","""Serene""","""Morning""","""Sunrise, park, bench, path, trees, fog""","""England""","""England""","""sunrise, park, bench, path, trees, fog"""
67,222.6,226.36666666666667,6678,6791,3.76666666666668,A woman in a black dress walking on a park path at sunset.,"[{""genre_hint"": ""Romance"", ""prominence_in_shot"": 0.5}]","[{""subgenre_hint"": ""Romantic"", ""prominence_in_shot"": 0.5}]","""Romantic""","""Serene""","""Park at sunset""","""A woman walking alone in a park at sunset""","""Park""","""Park""","""Romantic, park, sunset"""
68,226.36666666666667,228.5,6791,6855,2.1333333333333258,A serene morning scene in a residential neighborhood.,"[{""genre_hint"": ""Fantasy"", ""prominence_in_shot"": 0.5}]","[{""subgenre_hint"": ""Romance"", ""prominence_in_shot"": 0.3}]","""sunlit""","""peaceful""","""early morning""","""morning walk""","""USA""","""USA""","""morning walk"""
69,228.5,230.5,6855,6915,2.0,A young girl in a white shawl and black pants walks down a path towards a cemetery gate at sunrise.,"[{""genre_hint"": ""Mystery"", ""prominence_in_shot"": 0.5}]","[{""subgenre_hint"": ""Fantasy"", ""prominence_in_shot"": 0.3}]","""Mysterious""","""Somber""","""Cemetery""","""Sunrise, Cemetery, Path, Girl, Shoes, Gate, Trees, Grass, Sun""","""Cemetery""","""Cemetery""","""Mystery, Cemetery, Path, Girl, Shoes, Gate, Trees, Grass, Sun"""
70,230.5,232.46666666666667,6915,6974,1.9666666666666686,A serene morning scene with a person walking towards a cemetery gate.,"[{""genre_hint"": ""Romance"", ""prominence_in_shot"": 0.5}]","[{""subgenre_hint"": ""Mystery"", ""prominence_in_shot"": 0.2}]","""Elegant""","""Serene""","""Morning""","""Sunrise, cemetery, path, person, gate, trees, grass, fog""","""England""","""England""","""sunrise, cemetery, path, person, gate, trees, grass, fog"""
71,232.46666666666667,236.96666666666667,6974,7109,4.5,A young girl walking towards a cemetery gate at sunrise.,"[{""genre_hint"": ""Mystery"", ""prominence_in_shot"": 0.5}]","[{""subgenre_hint"": ""Fantasy"", ""prominence_in_shot"": 0.2}]","""Ethereal""","""Somber""","""Graveyard""","""Sunrise, cemetery, girl, gate, path, grass, trees, fog""","""None""","""None""","""Graveyard, cemetery, girl, gate, path, grass, trees, fog"""
72,236.96666666666667,242.36666666666667,7109,7271,5.400000000000006,"A young woman in a black dress is kneeling in a cemetery, reading a letter from a gravestone.","[{""genre_hint"": ""drama"", ""prominence_in_shot"": 1}]","[{""subgenre_hint"": ""romance"", ""prominence_in_shot"": 1}]","""melancholy""","""sadness""","""graveyard""","""touching moment""","""USA""","""USA""","""touching moment"""
73,242.36666666666667,248.23333333333332,7271,7447,5.866666666666646,"A young woman with short dark hair is standing in a cemetery, holding a bouquet of white daisies.","[{""genre_hint"": ""drama"", ""prominence_in_shot"": 1}]","[{""subgenre_hint"": ""tragedy"", ""prominence_in_shot"": 1}]","""melancholy""","""sad""","""graveyard""","""funeral""","""USA""","""USA""","""funeral, daisies, cemetery"""
74,248.23333333333332,251.1,7447,7533,2.8666666666666742,"A woman in a black coat stands at the entrance of a cemetery, looking towards the camera.","[{""genre_hint"": ""drama"", ""prominence_in_shot"": ""high""}]","[{""subgenre_hint"": ""romance"", ""prominence_in_shot"": ""high""}]","""melancholy""","""sad""","""graveyard""","""funeral""","""England""","""United States""","""funeral, cemetery, woman, black coat"""
75,251.1,255.16666666666666,7533,7655,4.066666666666663,A woman in a black coat stands in front of a wrought iron gate at sunset in a cemetery.,"[{""genre_hint"": ""drama"", ""prominence_in_shot"": 1}]","[{""subgenre_hint"": ""emotional"", ""prominence_in_shot"": 1}]","""melancholic""","""sad""","""graveyard""","""funeral""","""USA""","""USA""","""funeral, cemetery, sunset"""
76,255.16666666666666,259.4,7655,7782,4.23333333333332,A Letter Never Sent,"[{""genre_hint"": ""Romance"", ""prominence_in_shot"": 0.5}]","[{""subgenre_hint"": ""Romantic Comedy"", ""prominence_in_shot"": 0.5}]","""romantic""","""sad""","""home""","""letter""","""home""","""home""","""letter never sent"""
77,259.4,264.1,7782,7923,4.7000000000000455,A Letter Never Sent,"[{""genre_hint"": ""Romance"", ""prominence_in_shot"": 0.5}]","[{""subgenre_hint"": ""Romantic Drama"", ""prominence_in_shot"": 0.3}]","""Romantic""","""Sorrowful""","""Private""","""Personal Letter""","""Private""","""Private""","""Private Letter"""
